date,sources,title,link
"02/06/2026, 10:14 AM, +0000 UTC",BBC,Bitcoin price crash to lowest level since Trump take office,https://www.bbc.com/pidgin/articles/cdexenlxrd4o
"02/05/2026, 06:27 PM, +0000 UTC",Yahoo Finance,"Bitcoin Crash Could Deepen to $38K, Say Analysts—Here's Why",https://finance.yahoo.com/news/bitcoin-crash-could-deepen-38k-182748963.html
"02/06/2026, 10:14 AM, +0000 UTC",Investing.com Canada,Bitcoin: Short-Term Upside Builds After Reversal From Weekly Lows,https://ca.investing.com/analysis/bitcoin-shortterm-upside-builds-after-reversal-from-weekly-lows-200621889
"02/05/2026, 04:47 PM, +0000 UTC",Yahoo Finance,‘Big Short’ Michael Burry Warns Bitcoin May Repeat 2022 Collapse Pattern,https://finance.yahoo.com/news/big-short-michael-burry-warns-164717085.html
"02/05/2026, 11:01 PM, +0000 UTC",Investor's Business Daily,Strategy's Saylor Touts 'Crypto President' As Bitcoin Plunges,https://www.investors.com/news/strategy-earnings-q4-bitcoin-price-mstr-plunge-michael-saylor/
"02/06/2026, 03:25 AM, +0000 UTC",cnn.com,"McCabe: Bitcoin is the ""currency of crime""",https://www.cnn.com/2026/02/05/politics/video/the-source-kaitlan-collins-cnn-nancy-guthrie-ransom-bitcoin
"02/06/2026, 12:56 AM, +0000 UTC",Yahoo Finance,"MicroStrategy Faces Catastrophic Risk as Bitcoin Falls to $60,000",https://finance.yahoo.com/news/microstrategy-faces-catastrophic-risk-bitcoin-005631941.html
"02/05/2026, 08:38 PM, +0000 UTC",theverge.com,"The price of Bitcoin drops below $65,000",https://www.theverge.com/tech/874603/bitcoin-price-drop-cryptocurrency
"02/05/2026, 08:03 PM, +0000 UTC",CoinDesk,"BTC price news: Bitcoin spirals toward $60,000, headed for worst drawdown since FTX crash",https://www.coindesk.com/markets/2026/02/05/bitcoin-drops-below-usd65-000-heading-to-worst-one-day-drawdown-since-ftx-blowup
"02/06/2026, 07:41 AM, +0000 UTC",Forbes,'Inevitable' $1M Bitcoin: Why Saylor Doubles Down At $64K,https://www.forbes.com/sites/boazsobrado/2026/02/06/inevitable-1m-bitcoin-why-saylor-doubles-down-at-64k/
"02/06/2026, 10:40 AM, +0000 UTC",The Motley Fool,Which Cryptocurrency Has More Upside Through 2030: Bitcoin vs. Cardano,https://www.fool.com/investing/2026/02/06/which-cryptocurrency-has-more-upside-through-2030/
"02/06/2026, 11:33 AM, +0000 UTC",Barron's,"Bitcoin, XRP, Ether Rebound from Lows. Why the Crypto Crisis Isn’t Over.",https://www.barrons.com/articles/bitcoin-price-xrp-ethereum-ai-tech-selloff-3bcbdb91
"02/06/2026, 10:14 AM, +0000 UTC",bloomberg.com,Bitcoin’s Slump Can Worsen as Icy Winter Sets In,https://www.bloomberg.com/opinion/articles/2026-02-06/bitcoin-slump-can-worsen-as-icy-winter-sets-in
"02/06/2026, 04:45 AM, +0000 UTC",CoinDesk,Bitcoin miner MARA moves $87 million BTC to various trading desks and exchanges,https://www.coindesk.com/markets/2026/02/06/bitcoin-miner-mara-moves-usd87-million-btc-to-various-trading-desks-and-exchanges
"02/06/2026, 01:02 AM, +0000 UTC",MarketWatch,Bitcoin swings wildly after worst day for the pioneering crypto since FTX collapse,https://www.marketwatch.com/story/the-bitcoin-selloff-is-deepening-after-worst-day-for-the-pioneering-crypto-since-ftx-collapse-dae49846
"02/06/2026, 03:07 AM, +0000 UTC",Yahoo Finance,Why IREN (IREN) Is Down 33.5% After Pivoting From Bitcoin Mining To Microsoft-Funded AI Cloud Expansion,https://finance.yahoo.com/news/why-iren-iren-down-33-030725098.html
"02/05/2026, 03:41 PM, +0000 UTC",Yahoo Finance,"Bitcoin Crashes Below $67K, Erasing All Gains Since Trump's Election Win",https://finance.yahoo.com/news/bitcoin-crashes-below-67k-erasing-154158584.html
"02/05/2026, 04:18 PM, +0000 UTC",Yahoo Finance,Bitcoin Crashed JPMorgan Sees Long-Term Upside vs Gold | US Crypto News,https://finance.yahoo.com/news/bitcoin-crashed-jpmorgan-sees-long-161810761.html
"02/06/2026, 09:47 AM, +0000 UTC",The Wall Street Journal,"U.S. Futures Fall, Bitcoin Stays Low as Riskoff Sentiment Continues",https://www.wsj.com/finance/u-s-futures-fall-bitcoin-stays-low-as-riskoff-sentiment-continues-b9a55315
"02/05/2026, 04:01 PM, +0000 UTC",Yahoo Finance,"Jim Cramer Sets Bitcoin 'Line In The Sand,' Urges Michael Saylor To Act Before Strategy's Q4 Earnings",https://finance.yahoo.com/news/jim-cramer-sets-bitcoin-line-160111156.html
"02/06/2026, 11:00 AM, +0000 UTC",Financial Times,Bitcoin investor’s company helped draft law to enable libertarian Caribbean development,https://www.ft.com/content/50c2f8e0-a0a4-4433-805d-46e9e0345d4a
"02/06/2026, 06:05 AM, +0000 UTC",The Block,"Strategy CEO: Bitcoin would need to plunge to $8,000 before balance sheet issues",https://www.theblock.co/post/388774/strategy-ceo-bitcoin-q4-earnings-call
"02/05/2026, 10:53 PM, +0000 UTC",Investing.com,"Crypto rout deepens, bitcoin slides nearly 50% from its record high",https://www.investing.com/news/cryptocurrency-news/bitcoin-price-today-plunges-below-71k-as-global-tech-selloff-hits-risk-assets-4486483
"02/05/2026, 11:42 PM, +0000 UTC",CoinDesk,"Bitcoin ETFs barely flinch as BTC slides 40%, Bloomberg’s Eric Balchunas says",https://www.coindesk.com/markets/2026/02/05/bitcoin-etfs-barely-flinch-as-btc-slides-40-bloomberg-s-eric-balchunas-says
"02/05/2026, 03:17 PM, +0000 UTC",CoinDesk,"BTC price: What next as Bitcoin falls under $68,000 with move to low-$60,000s likely",https://www.coindesk.com/markets/2026/02/05/bitcoin-falls-under-usd69-000-with-retail-traders-betting-on-ever-lower-prices
"02/06/2026, 09:22 AM, +0000 UTC",simplywall.st,Strategy’s Record US$12.4b Loss Deepens Bitcoin Lever And Investor Risks,https://simplywall.st/stocks/us/software/nasdaq-mstr/strategy/news/strategys-record-us124b-loss-deepens-bitcoin-lever-and-inves
"02/06/2026, 02:39 AM, +0000 UTC",CoinDesk,Bitcoin isn’t losing to gold. It is navigating a liquidity squeeze that the yellow metal never had: Asia Morning Briefing,https://www.coindesk.com/markets/2026/02/06/bitcoin-isn-t-losing-to-gold-it-is-navigating-a-liquidity-squeeze-that-the-yellow-metal-never-had-asia-morning-briefing
"02/02/2026, 10:45 PM, +0000 UTC",ABC News,Why has the price of bitcoin plummeted? Experts explain,https://abcnews.go.com/Business/price-bitcoin-plummeted-experts-explain/story?id=129778940
"02/06/2026, 05:20 AM, +0000 UTC",CoinDesk,"CoinDesk: Bitcoin, Ethereum, XRP, Crypto News and Price Data",https://www.coindesk.com/
"02/06/2026, 05:19 AM, +0000 UTC",Investing.com Canada,Strategy Inc (MSTR) Q4 2025 Earnings Call Highlights: Navigating Bitcoin Volatility and Capital ... By GuruFocus,https://ca.investing.com/news/company-news/strategy-inc-mstr-q4-2025-earnings-call-highlights-navigating-bitcoin-volatility-and-capital--4442410
"02/03/2026, 07:09 PM, +0000 UTC",CNBC,"Bitcoin briefly breaks below $73,000 to lowest since November 2024 as heavy selling resumes",https://www.cnbc.com/2026/02/03/bitcoin-price-today.html
"02/05/2026, 08:30 PM, +0000 UTC",Business Insider,Bitcoin is in 'full capitulation mode' as analysts see further losses below $64k,https://www.businessinsider.com/why-bitcoin-is-falling-price-prediction-btc-outlook-technical-analysis-2026-2
"02/05/2026, 12:54 PM, +0000 UTC",CNBC,"Op-Ed: Move over Bitcoin, Kalshi and silver just ate your lunch",https://www.cnbc.com/2026/02/05/bitcoin-crypto-prediction-markets-kalshi-polymarket-silver.html
"02/05/2026, 03:57 PM, +0000 UTC",Yahoo Finance,"After Slump, Bitcoin Now Trails S&P 500, Nasdaq 100, Gold Over Five Years",https://finance.yahoo.com/news/bitcoin-trails-p-500-nasdaq-155750909.html
"02/05/2026, 01:06 PM, +0000 UTC",Yahoo Finance,"‘Big Short’ Investor Michael Burry Flags Bitcoin Chart Pattern Implying Drop to Low $50,000s",https://finance.yahoo.com/news/big-short-investor-michael-burry-130657366.html
"02/06/2026, 12:05 AM, +0000 UTC",Yahoo Finance,Bitcoin treasury Strategy posts $12.4b Q4 loss but Saylor tells investors not to panic,https://finance.yahoo.com/news/bitcoin-treasury-strategy-posts-12-000512977.html
"02/05/2026, 05:28 PM, +0000 UTC",Seeking Alpha,Bitcoin’s 45% Plunge Is A Warning Of A Bigger Liquidity Problem,https://seekingalpha.com/article/4866544-bitcoin-45-percent-plunge-is-a-warning-of-a-bigger-liquidity-problem
"02/06/2026, 03:15 AM, +0000 UTC",galaxy.com,State of the Bitcoin Bear Market with Beimnet Abebe,https://www.galaxy.com/insights/podcasts/galaxy-brains/state-of-the-bitcoin-bear-market-with-beimnet-abebe
"02/02/2026, 03:19 PM, +0000 UTC",CNBC,Strategy slides after bitcoin briefly dips below crypto firm's key breakeven level,https://www.cnbc.com/2026/02/02/strategy-slides-after-bitcoin-briefly-dips-below-crypto-firms-key-breakeven-level-.html
"02/02/2026, 10:48 AM, +0000 UTC",CNBC,Bitcoin is coming off a brutal week. Here's what's happening,https://www.cnbc.com/2026/02/02/bitcoin-btc-price-today-cryptocurrency.html
"02/04/2026, 11:22 AM, +0000 UTC",Forbes,"Serious $50,000 Bitcoin Price Warning Ignites Crypto Crash Fears",https://www.forbes.com/sites/digital-assets/2026/02/04/binance-founder-suddenly-flips-as-bitcoin-price-plummet-sparks-crash-fears/
"02/02/2026, 02:32 AM, +0000 UTC",CoinDesk,'This is absolutely INSANE': Bitcoin’s weekend crash exposes the cracks beneath crypto’s latest boom,https://www.coindesk.com/markets/2026/02/01/this-is-absolutely-insane-bitcoin-s-weekend-crash-exposes-the-cracks-beneath-crypto-s-latest-boom
"02/02/2026, 02:32 AM, +0000 UTC",Investing.com,"Bitcoin price today: slips to $77k, near 10-mth low amid liquidations, Fed caution",https://www.investing.com/news/cryptocurrency-news/bitcoin-price-today-slips-to-77k-near-10mth-low-amid-liquidations-fed-caution-4477764
"02/02/2026, 04:42 AM, +0000 UTC",Yahoo Finance,Bitcoin Derivatives Signal Elevated Stress Following Market Rout,https://finance.yahoo.com/news/bitcoin-derivatives-signal-elevated-stress-044240441.html
"02/02/2026, 05:01 AM, +0000 UTC",Bloomberg,Michael Saylor’s High-Stakes Bitcoin Bet Faces Fresh Strain,https://www.bloomberg.com/news/articles/2026-02-02/michael-saylor-s-high-stakes-bitcoin-bet-faces-fresh-strain
"02/02/2026, 06:11 AM, +0000 UTC",Yahoo Finance,Bitcoin Pullback Exposes MicroStrategy to Around $1 Billion in Paper Losses,https://finance.yahoo.com/news/bitcoin-pullback-exposes-microstrategy-around-061142398.html
"01/31/2026, 10:20 PM, +0000 UTC",Forbes,"Bitcoin Drops Below $78,000 After Trump Taps Kevin Warsh To Lead Federal Reserve",https://www.forbes.com/sites/mikestunson/2026/01/31/bitcoin-is-dropping-fast-heres-why-it-dropped-below-78000/
"01/30/2026, 09:35 PM, +0000 UTC",Yahoo Finance,Bitcoin Stuck in a Rut After Warsh Pick as ETFs Shed Billions,https://finance.yahoo.com/news/bitcoin-stuck-rut-warsh-pick-213531831.html
"01/30/2026, 06:11 PM, +0000 UTC",Barron's,"Bitcoin, XRP, Ethereum Fall on News of Kevin Warsh Fed Appointment.",https://www.barrons.com/articles/bitcoin-xrp-ethereum-crypto-today-954298d9?gaa_at=eafs&gaa_n=AWEtsqeu06PxOcFpvlA8WXPLLlTxcvXBbppeN_m96hR9PwNr5kf1aq3-n2_6&gaa_ts=698052d7&gaa_sig=6sus5ZoDv1KSwbLbAaIXX3lktzpJMCPNJGxo97d4XyOhIEfr6hx1AGpeZ7_MssyHY-443nli7Kh2RTZqqA6XkA%3D%3D
"01/30/2026, 02:38 PM, +0000 UTC",Barron's,The Slide in Gold and Silver Sets Up a Test for Bitcoin,https://www.barrons.com/articles/the-slide-in-gold-and-silver-sets-up-a-test-for-bitcoin-2a9573b3?gaa_at=eafs&gaa_n=AWEtsqc9_nGliocOiodtCQnDvzFIIj-H3vpdnnDF2VIDME_sJSqZPnGrk80-&gaa_ts=698052d7&gaa_sig=1cS1alzFgfyicAXNdEPblw0dQECkkuqgeyYVUuYe_mnf8aKS334ksX5DaO6_8DYvG76l5BrhzJe6t0_wDZk-Cw%3D%3D
"01/30/2026, 08:11 PM, +0000 UTC",The Block,"JPMorgan says bitcoin futures oversold as silver flips overbought, sees $8,500 gold long term",https://www.theblock.co/post/387893/jpmorgan-bitcoin-gold-silver-8500-long-term
"02/01/2026, 11:23 PM, +0000 UTC",MarketWatch,"U.S. stock futures fall after bitcoin’s weekend drop, as gold and silver’s sell-off may be bleeding into other markets",https://www.marketwatch.com/story/u-s-stock-futures-fall-along-with-bitcoin-and-oil-prices-21adfaf3?gaa_at=eafs&gaa_n=AWEtsqdgUuTXzqR95zagvXHnJ0dVfM9S7q1tU12pzPdmz9S03svoL3XrcYjL&gaa_ts=698052d7&gaa_sig=VtvY6xYq7y68TsPpJqrJDu1abuXQLaXyxHoCVZjmkq8pxGqBqPGUfJ1YlZ1ZQ1YNeNHCc11d_7fFCP-GqLcI4Q%3D%3D
"01/30/2026, 05:53 PM, +0000 UTC",Fortune,The crypto industry used to store Bitcoin in Swiss vaults. Now one firm is using vaults to hold gold instead,https://fortune.com/2026/01/30/the-crypto-industry-used-to-store-bitcoin-in-swiss-vaults-now-one-firm-is-using-vaults-to-hold-gold-instead/
"02/01/2026, 01:55 PM, +0000 UTC",Times of India,"If you bought just $1 of Bitcoin when it launched 17 years ago, how rich would you be today?",https://timesofindia.indiatimes.com/business/if-you-bought-just-1-of-bitcoin-when-it-launched-17-years-ago-how-rich-would-you-be-today/articleshow/127841336.cms
"02/01/2026, 05:27 PM, +0000 UTC",The Telegraph,Bitcoin wipeout erases entire Trump-era gains,https://www.telegraph.co.uk/business/2026/02/01/bitcoin-wipeout-erases-entire-trump-era-gains/
"02/02/2026, 03:18 AM, +0000 UTC",Yahoo Finance,"Bitcoin hovers near $77,000 but 'investors not yet positioned to buy the dip'",https://finance.yahoo.com/news/bitcoin-hovers-near-77000-with-broader-downtrend-intact-031855411.html
"02/01/2026, 09:36 PM, +0000 UTC",Barron's,Bitcoin’s Price Sinks Further. What to Know.,https://www.barrons.com/articles/bitcoins-price-sinks-further-what-to-know-7126457b?gaa_at=eafs&gaa_n=AWEtsqcp-yVYGlSBHGFFHER65UQvpr18n7qxzdh_2GIrYg_xLrxR6aSI2Wmo&gaa_ts=698052d7&gaa_sig=WeqAG1HQLF3Tl51OAORZFXlQJEwExRWqS8S0zbVtvTqN9dqbL_13-LHds2so2HA3F-osWxeBJanLjMP0S03oQw%3D%3D
"02/02/2026, 04:20 AM, +0000 UTC",Bloomberg,Bitcoin (BTC) Flirts With Lowest Price Since Trump’s Return to Office,https://www.bloomberg.com/news/articles/2026-02-02/bitcoin-flirts-with-lowest-price-since-trump-s-return-to-office
"02/01/2026, 11:35 PM, +0000 UTC",PYMNTS.com,Bitcoin Falls Below $80K Amid Wait on Crypto Legislation,https://www.pymnts.com/cryptocurrency/2026/bitcoin-falls-below-80k-amid-wait-on-crypto-legislation/
"02/02/2026, 03:26 AM, +0000 UTC",Seeking Alpha,"Bitcoin's Fall, Why Now Is The Time For A Contrarian-Long IBIT Play (NASDAQ:IBIT)",https://seekingalpha.com/article/4864811-bitcoins-fall-why-now-is-the-time-for-a-contrarian-long-ibit-play
"02/01/2026, 02:55 PM, +0000 UTC",Financial Times,Bitcoin price slides to lowest level since 2025 tariff shock,https://www.ft.com/content/faeb72a0-62ce-4d60-968e-5b932ea9c7e4
"01/31/2026, 07:59 PM, +0000 UTC",CNBC,"Bitcoin dips below $79,000 as market digests silver sell-off, Trump's Fed chair pick",https://www.cnbc.com/2026/01/31/bitcoin-dips-below-78000-after-silver-selloff.html
"01/29/2026, 02:30 PM, +0000 UTC",Britannica,"Bitcoin | Definition, Mining, & Facts | Britannica Money",https://www.britannica.com/money/Bitcoin
"01/30/2026, 10:09 AM, +0000 UTC",Morningstar Canada,Bitcoin in 2026: How Investors Should Approach Cryptocurrencies Now,https://global.morningstar.com/en-nd/markets/bitcoin-2026-what-investors-should-think-about-cryptocurrencies-now
"02/02/2026, 04:19 AM, +0000 UTC",CoinDesk,"Bitcoin rebounds above $75,000 after brief slide as thin liquidity keeps traders on edge",https://www.coindesk.com/markets/2026/02/02/bitcoin-rebounds-above-usd75-000-after-brief-slide-as-thin-liquidity-keeps-traders-on-edge
"02/01/2026, 04:32 PM, +0000 UTC",Bloomberg,"Bitcoin’s Break Below $80,000 Signals New Crisis of Confidence",https://www.bloomberg.com/news/articles/2026-02-01/bitcoin-s-break-below-80-000-signals-new-crisis-of-confidence
"02/01/2026, 04:46 PM, +0000 UTC",Yahoo Finance,MicroStrategy Doubles Down on Bitcoin Despite Recent Price Struggles,https://finance.yahoo.com/news/microstrategy-doubles-down-bitcoin-despite-164629984.html
"01/31/2026, 04:20 PM, +0000 UTC",Yahoo Finance,Here Are Bitcoin's 5 Biggest Risks That Investors Can't Ignore,https://finance.yahoo.com/news/bitcoins-5-biggest-risks-investors-162000782.html
"02/01/2026, 07:07 PM, +0000 UTC",CoinDesk,Bitcoin's 'hopium' for bulls may be over and this weekend's slide could be just the beginning,https://www.coindesk.com/markets/2026/02/01/bitcoin-s-hopium-for-bulls-may-be-over-and-this-weekend-s-slide-could-be-just-the-beginning
"02/01/2026, 03:34 PM, +0000 UTC",CoinDesk,"Here's why bitcoin traders are now betting billions on a drop to $75,000 and bailing on price rising higher",https://www.coindesk.com/markets/2026/02/01/bets-on-bitcoin-slide-below-usd75-000-are-now-as-hot-as-those-usd100-000-plays
"02/01/2026, 10:30 AM, +0000 UTC",Yahoo Finance,Bitcoin Price Hits 9-Month Low Amid $2.6 Billion Liquidation: What’s Next?,https://finance.yahoo.com/news/bitcoin-price-hits-9-month-103000832.html
"02/01/2026, 11:46 AM, +0000 UTC",Yahoo Finance,"Analysts divided on Bitcoin bear market calls as prices inch up from $77,000",https://finance.yahoo.com/news/analysts-divided-bitcoin-bear-market-114600996.html
"02/02/2026, 12:10 AM, +0000 UTC",FOREX.com,Bitcoin Slide Deepens as BTC/USD Squeeze Risk Builds,https://www.forex.com/en-us/news-and-analysis/bitcoin-slide-deepens-as-btc-usd-squeeze-risk-builds/
"01/31/2026, 06:02 PM, +0000 UTC",Reuters,"Bitcoin falls below $80,000, continuing decline as liquidity worries mount",https://www.reuters.com/business/bitcoin-falls-below-80000-continuing-decline-2026-01-31/
"02/01/2026, 03:04 PM, +0000 UTC",CoinDesk,Michael Saylor hints at another bitcoin purchase despite market turmoil,https://www.coindesk.com/markets/2026/02/01/michael-saylor-signals-another-bitcoin-buy-as-btc-price-slumps-to-usd78-000
"02/02/2026, 07:00 AM, +0000 UTC",CoinDesk,Bitcoin's price crash exposes painful truth – crypto market still dances to BTC's tune,https://www.coindesk.com/markets/2026/02/02/bitcoin-s-crash-exposes-painful-truth-crypto-market-still-dances-to-btc-s-tune
"01/31/2026, 05:45 PM, +0000 UTC",Yahoo Finance,"Bitcoin Price Drops Below $80,000 as New Buyers Rush to Accumulate",https://finance.yahoo.com/news/bitcoin-price-drops-below-80-174544304.html
"02/02/2026, 05:29 AM, +0000 UTC",Seeking Alpha,"Crypto slide intensifies as bitcoin hits around $75,000 (BTC-USD:Cryptocurrency)",https://seekingalpha.com/news/4545118-crypto-slide-intensifies-as-bitcoin-hits-around-75000
"02/01/2026, 06:38 AM, +0000 UTC",Yahoo Finance,"Bitcoin drops to $78,000 as Strategy-fueled rally runs out of buyers, traders say",https://finance.yahoo.com/news/bitcoin-drops-78-000-microstrategy-063805535.html
"02/01/2026, 11:30 PM, +0000 UTC",CNBC,"Stock futures fall after silver, bitcoin sell off; questions loom over AI trade: Live updates",https://www.cnbc.com/2026/02/01/stock-market-today-live-updates.html
"01/31/2026, 06:12 PM, +0000 UTC",Yahoo Finance,"Bitcoin price plunges below $80,000 as $1.6b liquidation wave intensifies selloff",https://finance.yahoo.com/news/bitcoin-price-plunges-below-80-181216840.html
"02/02/2026, 02:38 AM, +0000 UTC",CoinDesk,"Bitcoin holds below $80,000 as January prediction contracts miss liquidation-driven slide: Asia Morning Briefing",https://www.coindesk.com/markets/2026/02/02/bitcoin-holds-below-usd80-000-as-january-prediction-contracts-miss-liquidation-driven-slide-asia-morning-briefing
"01/31/2026, 11:28 PM, +0000 UTC",Barron's,"Bitcoin Falls Again, Dropping Below $80,000. What to Know.",https://www.barrons.com/articles/bitcoin-price-news-gold-silver-trump-fed-warsh-db35f5ad?gaa_at=eafs&gaa_n=AWEtsqeVJqpLnTR86r6vdshG4DunJ1mp6IXtysYuuzVf5Yvv4hwHwSAS4RiE&gaa_ts=698052d7&gaa_sig=Z4_sNWC9Cd3oYSo2hxFRLWN9Iq7d0Hu3DeNLXpF7P0VHsHdmU9gNGy_NgVlGycMPc14ZRLZ-8GqXkGwGb_AW5w%3D%3D
"01/30/2026, 05:10 AM, +0000 UTC",Reuters,Bitcoin slips as Fed chair speculation hits risky assets,https://www.reuters.com/business/bitcoin-slips-fed-chair-speculation-hits-risky-assets-2026-01-30/
"01/31/2026, 08:51 PM, +0000 UTC",Yahoo Finance,Strategy Inc. (MSTR) Bolsters Bitcoin Holdings after Shares Sale,https://finance.yahoo.com/news/strategy-inc-mstr-bolsters-bitcoin-205113152.html
"01/30/2026, 06:40 PM, +0000 UTC",Fortune,"Bitcoin’s freefall approaches $80,000 as precious metals also tank",https://fortune.com/2026/01/30/bitcoin-price-today-ethereum-gold-silver-platinum-copper/
"01/30/2026, 08:51 PM, +0000 UTC",Yahoo Finance,Bitcoin Price Holds Steady as Gold Falls and Silver Craters,https://finance.yahoo.com/news/bitcoin-price-holds-steady-gold-205100385.html
"01/29/2026, 06:47 PM, +0000 UTC",Yahoo Finance,Bitcoin price dips fast as crypto joins Big Tech in market dive,https://finance.yahoo.com/news/bitcoin-price-dips-fast-crypto-184706268.html
"02/02/2026, 04:46 AM, +0000 UTC",Decrypt,Bitcoin Derivatives Signal Elevated Stress Following Market Rout,https://decrypt.co/356594/bitcoin-derivatives-signal-elevated-stress
"01/31/2026, 02:37 PM, +0000 UTC",Yahoo Finance,Will Bitcoin Price Crash in 2026 as Market Volatility Rises?,https://finance.yahoo.com/news/bitcoin-price-crash-2026-market-143728988.html
"02/01/2026, 09:45 PM, +0000 UTC",Bitcoin.com News,"5 Warning Signs Emerging Across Bitcoin, Gold, and Global Markets",https://news.bitcoin.com/5-warning-signs-emerging-across-bitcoin-gold-and-global-markets/
"01/31/2026, 09:08 PM, +0000 UTC",Yahoo Finance,"Michael Saylor’s bitcoin stack is officially underwater, but here’s why he likely won't reach for the panic button",https://finance.yahoo.com/news/michael-saylor-bitcoin-stack-officially-210853248.html
"02/01/2026, 06:01 PM, +0000 UTC",Binance,Bitcoin Price Forecasts Turn Bearish as BTC Follows Old Bear Market Patterns,https://www.binance.com/el/square/post/35879787060337
"01/31/2026, 09:20 PM, +0000 UTC",Bloomberg,"Bitcoin Plunges Below $80,000 as the Crypto Slide Deepens",https://www.bloomberg.com/news/articles/2026-01-31/bitcoin-plunges-below-80-000-as-the-crypto-slide-accelerates
"01/31/2026, 02:46 PM, +0000 UTC",Yahoo Finance,"Bitcoin plunges near $77,000 as geopolitical risks deepens amid U.S-Iran tension",https://finance.yahoo.com/news/bitcoin-plunges-under-81-000-144646897.html
"02/01/2026, 01:35 PM, +0000 UTC",CryptoSlate,Bitcoin institutions finally admit this is a bear market - so why do 70% say the price is still undervalued?,https://cryptoslate.com/bitcoin-institutions-admit-we-are-in-a-bear-market-but-70-say-the-price-is-still-undervalued/
"01/29/2026, 03:36 PM, +0000 UTC",Yahoo Finance,Why Gold is Rallying and Bitcoin Isn’t,https://finance.yahoo.com/news/why-gold-rallying-bitcoin-isn-153600430.html
"01/30/2026, 03:04 PM, +0000 UTC",Yahoo Finance,Fed Chair nominee Warsh views bitcoin as “good policeman for policy”,https://finance.yahoo.com/news/fed-chair-nominee-warsh-views-150459398.html
"01/30/2026, 09:35 PM, +0000 UTC",Bloomberg,Bitcoin Slumps to Two-Month Low as US Funds Shed Billions,https://www.bloomberg.com/news/articles/2026-01-30/bitcoin-btc-slumps-to-two-month-low-as-us-funds-shed-billions
"01/29/2026, 02:25 AM, +0000 UTC",Yahoo Finance,Bitcoin Hasn't Had a Bad Day Yet in 2026. Is the Leading Crypto Set to Bounce Back in 2026?,https://finance.yahoo.com/news/bitcoin-hasnt-had-bad-day-022500649.html
"01/31/2026, 01:02 PM, +0000 UTC",Yahoo Finance,"Bitcoin Price Falling To $30,000? Influencer Predicts Collapse In Wake of Global Market Crash",https://finance.yahoo.com/news/bitcoin-price-falling-30-000-130215603.html
"02/01/2026, 03:11 PM, +0000 UTC",Yahoo Finance,Strategy Doubles Down On Bitcoin Model As Stretch Dividend Rises Again,https://finance.yahoo.com/news/strategy-doubles-down-bitcoin-model-151146865.html
"02/02/2026, 12:17 AM, +0000 UTC",CCN.com,Epstein Claimed ‘Bitcoin Founder’ Ties as Ripple (XRP) and Stellar (XLM) Faced Pushback — Is Crypto's Future in Danger?,https://www.ccn.com/education/crypto/jeffrey-epstein-satoshi-nakamoto-epstein-files-bitcoin-founders-ripple-xrp-stellar-xlm/
"01/30/2026, 12:28 PM, +0000 UTC",The Motley Fool,"The Bitcoin Sell-Off Is Getting Worse, but That Won't Stop Me From Buying Even More",https://www.fool.com/investing/2026/01/30/the-bitcoin-sell-off-is-getting-worse-but-it-wont/
"01/31/2026, 12:17 PM, +0000 UTC",The Motley Fool,Better Investment to Make in 2026 and Beyond: Bitcoin vs. iShares Bitcoin Trust,https://www.fool.com/investing/2026/01/31/better-investment-2026-beyond-bitcoin-ibit/
"01/29/2026, 09:34 PM, +0000 UTC",Yahoo Finance,Bitcoin Plunge Could Get Much Worse as Death Cross Gains Power,https://finance.yahoo.com/news/bitcoin-plunge-could-much-worse-213438632.html
"02/01/2026, 02:48 PM, +0000 UTC",Yahoo Finance,Bitcoin ETFs See $6 Billion Exit as Institutional Demand Cools,https://finance.yahoo.com/news/bitcoin-etfs-see-6-billion-144855237.html
"02/01/2026, 04:03 PM, +0000 UTC",CoinDesk,"Bitcoin isn’t competing with gold, but rather prediction markets and ultra-short options",https://www.coindesk.com/markets/2026/02/01/how-instant-gratification-is-sucking-the-air-out-of-the-bitcoin-market
"01/30/2026, 10:15 AM, +0000 UTC",The Motley Fool,Better Crypto Buy: Bitcoin vs. Ethereum,https://www.fool.com/investing/2026/01/30/better-crypto-buy-bitcoin-vs-ethereum/
"01/29/2026, 09:51 AM, +0000 UTC",Yahoo Finance UK,Bitcoin price slides as gold rallies on weaker dollar,https://uk.finance.yahoo.com/news/bitcoin-price-gold-dollar-interest-rates-crypto-095142360.html
"02/02/2026, 02:58 AM, +0000 UTC",조선일보,"Bitcoin Drop Hurts Treasury Stocks, Strategy Chief Eyes More Buys",https://www.chosun.com/english/market-money-en/2026/02/02/2MET4M45PVAWLELZRNB4M2II6E/
"01/31/2026, 06:55 PM, +0000 UTC",Seeking Alpha,Bitcoin slips below $80K amid crypto selloff (BTC-USD),https://seekingalpha.com/news/4545076-bitcoin-slips-below-80k-amid-crypto-selloff
"01/28/2026, 12:20 PM, +0000 UTC",Yahoo Finance,Is Bitcoin a Buy Right Now?,https://finance.yahoo.com/news/bitcoin-buy-now-122000688.html
"01/30/2026, 10:35 AM, +0000 UTC",Yahoo Finance,Better Crypto Buy: Bitcoin vs. Ethereum,https://finance.yahoo.com/news/better-crypto-buy-bitcoin-vs-103500722.html
